{
  "$schema": "https://json-schema.org/draft/2020-12/schema",
  "$id": "proofs/schemas/blocked.schema.json",
  "title": "Stage 0 blocked marker",
  "type": "object",
  "additionalProperties": false,
  "required": ["proof_id", "classification", "env_fingerprint", "marker"],
  "properties": {
    "proof_id": {"type": "string", "pattern": "^S0-(0[1-9]|1[0-2])$"},
    "classification": {"enum": ["blocked_credential", "blocked_host"]},
    "env_fingerprint": {"type": "string", "pattern": "^(pc-bridge|sandbox):.+$"},
    "marker": {
      "type": "object",
      "additionalProperties": false,
      "required": ["probe_cmd", "probe_run", "blocker_status", "unblock_condition", "owner"],
      "properties": {
        "probe_cmd": {"type": "array", "minItems": 1, "items": {"type": "string"}},
        "probe_run": {"$ref": "#/$defs/run"},
        "blocker_status": {"enum": ["absent", "rejecting", "expired"]},
        "reason": {"enum": ["credential_absent", "credential_rejected", "capability_absent", "capability_present_but_failing"]},
        "unblock_condition": {"type": "string", "minLength": 1},
        "owner": {"type": "string", "minLength": 1}
      }
    }
  },
  "$defs": {
    "sha256": {"type": "string", "pattern": "^[0-9a-f]{64}$"},
    "artifact": {
      "type": "object",
      "additionalProperties": false,
      "required": ["path", "sha256"],
      "properties": {
        "path": {"type": "string", "minLength": 1},
        "sha256": {"$ref": "#/$defs/sha256"}
      }
    },
    "run": {
      "type": "object",
      "additionalProperties": false,
      "required": ["leg", "cmd", "started_at", "finished_at", "exit_code", "stdout_sha256", "stderr_sha256"],
      "properties": {
        "leg": {"enum": ["positive", "negative"]},
        "cmd": {"type": "array", "minItems": 1, "items": {"type": "string"}},
        "started_at": {"type": "string", "format": "date-time"},
        "finished_at": {"type": "string", "format": "date-time"},
        "exit_code": {"type": "integer"},
        "stdout_sha256": {"$ref": "#/$defs/sha256"},
        "stderr_sha256": {"$ref": "#/$defs/sha256"},
        "artifacts": {"type": "array", "items": {"$ref": "#/$defs/artifact"}}
      }
    }
  }
}
