{
  "proof_id": "S0-03",
  "classification": "blocked_credential",
  "env_fingerprint": "pc-bridge:fedora",
  "marker": {
    "probe_cmd": [
      "python3",
      "proofs/S0-03/probe_omniroute.py",
      "http://127.0.0.1:20128/v1/models"
    ],
    "probe_run": {
      "leg": "negative",
      "cmd": [
        "python3",
        "proofs/S0-03/probe_omniroute.py",
        "http://127.0.0.1:20128/v1/models"
      ],
      "started_at": "2026-09-08T00:50:33.981847Z",
      "finished_at": "2026-09-08T00:50:35.136149Z",
      "exit_code": 0,
      "stdout_sha256": "e3b0c44298fc1c149afbf4c8996fb92427ae41e4649b934ca495991b7852b855",
      "stderr_sha256": "e3b0c44298fc1c149afbf4c8996fb92427ae41e4649b934ca495991b7852b855"
    },
    "blocker_status": "expired",
    "unblock_condition": "secret OMNIROUTE_UPSTREAM_KEY present and accepted",
    "owner": "TBD-owner-credential"
  }
}
